{
  "run_id": "forge-template-EXAMPLE",
  "spec": "TEMPLATE — Reemplazar con la SPEC real del run. Debe responder: qué, por qué, criterio de salida.",
  "created_at": "2026-01-01T00:00:00.000000+00:00",
  "updated_at": "2026-01-01T00:00:00.000000+00:00",
  "actions": [],
  "approvals": [],
  "proof": [],
  "final_status": "running",
  "metadata": {
    "hard_gates_passed": 0,
    "soft_score": 0.0,
    "total_files_changed": 0,
    "rollbacks_executed": 0,
    "canary_fixes_applied": 0
  }
}
