{
  "run_id": "forge-example-fix-route-action",
  "spec": "Refactor data_specialist.route_action (CC=52) usando dict dispatch pattern. Criterio de salida: CC<10, tests pasan, ruff clean.",
  "created_at": "2026-06-27T13:00:00.000000+00:00",
  "updated_at": "2026-06-27T13:30:00.000000+00:00",
  "actions": [
    {
      "action_type": "edit_file",
      "permission": "allow",
      "target": "src/hat/level3_specialists/datos_auto/data_specialist.py",
      "diff_summary": "Refactor route_action: replace if/elif chain with _ROUTING_TABLE dict dispatch",
      "before_sha": "abc1234",
      "after_sha": "def5678",
      "rollback": "git checkout abc1234 -- src/hat/level3_specialists/datos_auto/data_specialist.py",
      "verified": true,
      "timestamp": "2026-06-27T13:15:00.000000+00:00",
      "stack": "python",
      "blast_radius": "low (single file, route_action is internal method)"
    },
    {
      "action_type": "run_test",
      "permission": "allow",
      "target": "pytest src/tests/hat/hardened/test_datos_auto_specialists.py -v",
      "diff_summary": "56 tests passed in 7.73s",
      "before_sha": "",
      "after_sha": "",
      "rollback": "",
      "verified": true,
      "timestamp": "2026-06-27T13:20:00.000000+00:00",
      "stack": "python"
    },
    {
      "action_type": "run_gate",
      "permission": "allow",
      "target": "radon cc src/hat/level3_specialists/datos_auto/data_specialist.py",
      "diff_summary": "route_action CC: 52 -> 8 (rank F -> rank C)",
      "before_sha": "",
      "after_sha": "",
      "rollback": "",
      "verified": true,
      "timestamp": "2026-06-27T13:25:00.000000+00:00",
      "stack": "python"
    }
  ],
  "approvals": [
    {
      "phase": "specify",
      "approved_by": "human",
      "timestamp": "2026-06-27T13:00:00.000000+00:00",
      "notes": "SPEC confirmada: refactor route_action sin cambiar API pública"
    },
    {
      "phase": "implement",
      "approved_by": "auto",
      "timestamp": "2026-06-27T13:15:00.000000+00:00",
      "notes": "Refactor aplicado con dict dispatch pattern"
    },
    {
      "phase": "verify",
      "approved_by": "auto",
      "timestamp": "2026-06-27T13:25:00.000000+00:00",
      "notes": "56 tests PASS, radon CC 52->8"
    }
  ],
  "proof": [
    {
      "gate_name": "tests_pass",
      "passed": true,
      "evidence": "56 tests passed in 7.73s",
      "stack": "python",
      "timestamp": "2026-06-27T13:20:00.000000+00:00"
    },
    {
      "gate_name": "complexity_max",
      "passed": true,
      "evidence": "route_action CC=8 (was 52). All other functions <10.",
      "stack": "python",
      "timestamp": "2026-06-27T13:25:00.000000+00:00"
    },
    {
      "gate_name": "lint_clean",
      "passed": true,
      "evidence": "ruff check src/... -> All checks passed!",
      "stack": "python",
      "timestamp": "2026-06-27T13:26:00.000000+00:00"
    }
  ],
  "final_status": "pass",
  "metadata": {
    "hard_gates_passed": 6,
    "soft_score": 9.5,
    "total_files_changed": 1,
    "rollbacks_executed": 0,
    "canary_fixes_applied": 1
  },
  "completed_at": "2026-06-27T13:30:00.000000+00:00"
}
